id,text,source,language_tag,concept,sentiment,shop_location,shop_category
88,Customers often come asking to replace the 'Element' of their heater. It's a cheap repair but requires technical skill. Offering repair services builds loyalty.,Web (Youtube),en,Service_Offering,Helpful,India_General,Electrical
89,Stock up on water heaters and immersion rods before winter peaks. Prices go up in the wholesale market as demand rises. Buying early ensures better profit margins.,Web (Youtube),en,Seasonal_Planning,Smart,India_General,Electrical
90,"Wholesalers sell shoes only in a 'Set' of sizes. If the middle sizes sell out, the small and large ones become dead stock. Breaking a set is the biggest challenge in shoe retail.",Web (Youtube),en,Inventory_Risk,Concerned,India_General,Fashion
91,Fashion changes quickly; don't overstock on trendy designs. What is hot today might be unsellable next month. Stick to classics for bulk stock and trends for display.,Web (Youtube),en,Trend_Analysis,Advisory,India_General,Fashion
92,"The shopkeeper eagerly waits for the first customer to do 'Bohni'. It is considered a good omen for the day's sales. If the Bohni is good, the whole day goes well.",Web (Youtube),hi,Superstition_and_Tradition,Hopeful,India_General,Fashion
93,"Treat every customer with patience, even if they don't buy immediately. A customer who leaves happy today might return tomorrow with family. Building a reputation is more important than a single sale.",Web (Youtube),hi_en,Customer_Retention,Proud,India_General,Fashion